benchmark,scenario_id,agent_name,overall_score,believability,relationship,knowledge,secret,social_rules,financial_and_material_benefits,goal,conversation_sample
Sotopia All,01H7VFHNF4G18PC9JHGRC8A1R6,Isabella White,2.0,8.0,-2.0,7.0,0.0,0.0,-3.0,4.0,"Environment: Turn #0: Mia Davis said: ""Isabella, I've been meaning to have a chat with you. I've noticed that there have been a few issues around the house that we need to address. It's important for me to maintain a certain order here, and I've observed that some of the house rules I have in place haven't been followed. Can we talk about this and find a solution?""

Environment: Turn #0: Mia Davis said: ""Isabella, I've been meaning to have a chat with you. I've noticed that there have been a few issues around the house that we need to address. It's important for me to maintain a certain order here, and I've observed that some of the house rules I have in place haven't been followed. Can we talk about this and find a solution?""

Mia Davis: did nothing"
Sotopia All,01H7VFHN3Q7498S3R4R2VDSXA0,Baxter Sterling,1.2857142857142858,8.0,-1.0,2.0,-5.0,0.0,0.0,5.0,"Environment: Turn #0: Hendrick Heinz said: ""Hey Baxter, I've been thinking... If we both stick to our story and stay silent, we could get out of this with just a fine. It's risky to turn on each other, don't you think? We're both seasoned enough to know the consequences if we don't play this smart.""

Environment: Turn #0: Hendrick Heinz said: ""Hey Baxter, I've been thinking... If we both stick to our story and stay silent, we could get out of this with just a fine. It's risky to turn on each other, don't you think? We're both seasoned enough to know the consequences if we don't play this smart.""

Hendrick Heinz: did nothing"
Sotopia All,01H7VFHNFVGFY578101R2PCV3T,Hendrick Heinz,3.2857142857142856,8.0,-1.0,9.0,0.0,0.0,0.0,7.0,"Environment: Turn #0: Leo Williams said: ""Hendrick, there's something I need to talk to you about. I want to be honest with you because I value our friendship. I've been involved with your partner, and it's weighing heavily on me. It was wrong, and I'm sorry for the pain this might cause. I know there's no easy way to say this, but you deserve to know the truth.""

Environment: Turn #0: Leo Williams said: ""Hendrick, there's something I need to talk to you about. I want to be honest with you because I value our friendship. I've been involved with your partner, and it's weighing heavily on me. It was wrong, and I'm sorry for the pain this might cause. I know there's no easy way to say this, but you deserve to know the truth.""

Leo Williams: did nothing"
Sotopia All,01H7VFHPQQQY6H4DNC6NBQ8XTG,Hendrick Heinz,1.7142857142857142,9.0,0.0,2.0,0.0,0.0,-1.0,2.0,"Environment: Turn #0: Samuel Anderson said: ""Hey Hendrick, I'm really interested in the Samsung Galaxy S8. I see you have quite a few of them, and since you're willing to offer a deal for multiple purchases, I'm thinking we might be able to work something out for a single one too. How about $400 for one phone?""

Environment: Turn #0: Samuel Anderson said: ""Hey Hendrick, I'm really interested in the Samsung Galaxy S8. I see you have quite a few of them, and since you're willing to offer a deal for multiple purchases, I'm thinking we might be able to work something out for a single one too. How about $400 for one phone?""

Samuel Anderson: did nothing"
Sotopia All,01H7VFHPM3NVVKSGCCB4S10465,Gwen Pierce,2.0,9.0,0.0,3.0,0.0,0.0,0.0,2.0,"Environment: Turn #0: Finnegan O'Malley said: ""Ah, what a lovely party! It's always nice to meet new faces. You know, being a lighthouse keeper might seem isolating, but I've managed to make a few friends along the way. Do you often find yourself around people from H. J. Heinz Company? I seem to bump into folks from there quite a bit.""

Environment: Turn #0: Finnegan O'Malley said: ""Ah, what a lovely party! It's always nice to meet new faces. You know, being a lighthouse keeper might seem isolating, but I've managed to make a few friends along the way. Do you often find yourself around people from H. J. Heinz Company? I seem to bump into folks from there quite a bit.""

Finnegan O'Malley: did nothing"
